17:03:52.114926 IP 192.168.248.50.2152 > 192.168.248.169.2152: UDP, length 92
17:03:52.125986 IP 192.168.248.169.2152 > 192.168.248.50.2152: UDP, length 92
17:03:53.128194 IP 192.168.248.50.2152 > 192.168.248.169.2152: UDP, length 92
17:03:53.140604 IP 192.168.248.169.2152 > 192.168.248.50.2152: UDP, length 92
17:03:54.128223 IP 192.168.248.50.2152 > 192.168.248.169.2152: UDP, length 92
17:03:54.137180 IP 192.168.248.169.2152 > 192.168.248.50.2152: UDP, length 92
17:03:54.213022 ARP, Request who-has 192.168.247.50 tell 192.168.247.112, length 46
17:03:55.136165 IP 192.168.248.50.2152 > 192.168.248.169.2152: UDP, length 92
17:03:55.147003 IP 192.168.248.169.2152 > 192.168.248.50.2152: UDP, length 92
17:03:56.136805 IP 192.168.248.50.2152 > 192.168.248.169.2152: UDP, length 92
17:03:56.144015 IP 192.168.248.169.2152 > 192.168.248.50.2152: UDP, length 92
17:03:56.241280 ARP, Request who-has 192.168.248.50 tell 192.168.248.169, length 46
17:03:56.243252 ARP, Reply 192.168.248.50 is-at 00:80:8e:8d:90:ab (oui Unknown), length 46
17:03:57.136772 IP 192.168.248.50.2152 > 192.168.248.169.2152: UDP, length 92
17:03:57.145132 IP 192.168.248.169.2152 > 192.168.248.50.2152: UDP, length 92
17:03:58.136396 IP 192.168.248.50.2152 > 192.168.248.169.2152: UDP, length 92
17:03:58.145509 IP 192.168.248.169.2152 > 192.168.248.50.2152: UDP, length 92
17:03:59.128772 IP 192.168.248.50.2152 > 192.168.248.169.2152: UDP, length 92
17:03:59.138000 IP 192.168.248.169.2152 > 192.168.248.50.2152: UDP, length 92
17:04:00.068387 IP 192.168.248.50.2152 > 192.168.248.169.2152: UDP, length 92
17:04:00.078036 IP 192.168.248.169.2152 > 192.168.248.50.2152: UDP, length 92
17:04:01.135773 IP 192.168.248.50.2152 > 192.168.248.169.2152: UDP, length 92
17:04:01.150234 IP 192.168.248.169.2152 > 192.168.248.50.2152: UDP, length 92
17:04:01.383493 ARP, Request who-has 192.168.248.169 tell 192.168.248.50, length 46
17:04:01.387176 ARP, Reply 192.168.248.169 is-at fa:16:3e:30:1e:d4 (oui Unknown), length 46
17:04:02.297282 IP 192.168.248.50.2152 > 192.168.248.169.2152: UDP, length 92
17:04:02.307271 IP 192.168.248.169.2152 > 192.168.248.50.2152: UDP, length 92
17:04:03.143265 IP 192.168.248.50.2152 > 192.168.248.169.2152: UDP, length 92
17:04:03.162395 IP 192.168.248.169.2152 > 192.168.248.50.2152: UDP, length 92
17:04:04.157545 IP 192.168.248.50.2152 > 192.168.248.169.2152: UDP, length 92
17:04:04.187565 IP 192.168.248.169.2152 > 192.168.248.50.2152: UDP, length 92
17:04:05.148234 IP 192.168.248.50.2152 > 192.168.248.169.2152: UDP, length 92
17:04:05.157336 IP 192.168.248.169.2152 > 192.168.248.50.2152: UDP, length 92
17:04:06.207815 IP 192.168.248.50.2152 > 192.168.248.169.2152: UDP, length 92
17:04:06.207973 IP 192.168.248.169.2152 > 192.168.248.50.2152: UDP, length 92
17:04:07.158394 IP 192.168.248.50.2152 > 192.168.248.169.2152: UDP, length 92
17:04:07.166835 IP 192.168.248.169.2152 > 192.168.248.50.2152: UDP, length 92
17:04:08.157976 IP 192.168.248.50.2152 > 192.168.248.169.2152: UDP, length 92
17:04:08.168907 IP 192.168.248.169.2152 > 192.168.248.50.2152: UDP, length 92
17:04:09.154261 IP 192.168.248.50.2152 > 192.168.248.169.2152: UDP, length 92
17:04:09.163275 IP 192.168.248.169.2152 > 192.168.248.50.2152: UDP, length 92
17:04:10.165988 IP 192.168.248.50.2152 > 192.168.248.169.2152: UDP, length 92
17:04:10.177351 IP 192.168.248.169.2152 > 192.168.248.50.2152: UDP, length 92
17:04:10.344873 IP 192.168.247.112.36412 > 192.168.247.50.36412: sctp (1) [HB REQ] 
17:04:11.241992 IP 192.168.248.50.2152 > 192.168.248.169.2152: UDP, length 92
17:04:11.255249 IP 192.168.248.169.2152 > 192.168.248.50.2152: UDP, length 92
17:04:12.244745 IP 192.168.248.50.2152 > 192.168.248.169.2152: UDP, length 92
17:04:12.257853 IP 192.168.248.169.2152 > 192.168.248.50.2152: UDP, length 92
17:04:13.176399 IP 192.168.248.50.2152 > 192.168.248.169.2152: UDP, length 92
17:04:13.184850 IP 192.168.248.169.2152 > 192.168.248.50.2152: UDP, length 92
17:04:14.162671 IP 192.168.248.50.2152 > 192.168.248.169.2152: UDP, length 92
17:04:14.178395 IP 192.168.248.169.2152 > 192.168.248.50.2152: UDP, length 92
17:04:15.175971 IP 192.168.248.50.2152 > 192.168.248.169.2152: UDP, length 92
17:04:15.187195 IP 192.168.248.169.2152 > 192.168.248.50.2152: UDP, length 92
17:04:15.722309 ARP, Reply 192.168.247.112 is-at fa:16:3e:a5:1d:5e (oui Unknown), length 46
17:04:16.185791 IP 192.168.248.50.2152 > 192.168.248.169.2152: UDP, length 92
17:04:16.194748 IP 192.168.248.169.2152 > 192.168.248.50.2152: UDP, length 92
17:04:17.186057 IP 192.168.248.50.2152 > 192.168.248.169.2152: UDP, length 92
17:04:17.203109 IP 192.168.248.169.2152 > 192.168.248.50.2152: UDP, length 92
17:04:18.175885 IP 192.168.248.50.2152 > 192.168.248.169.2152: UDP, length 92
17:04:18.185704 IP 192.168.248.169.2152 > 192.168.248.50.2152: UDP, length 92
17:04:19.178541 IP 192.168.248.50.2152 > 192.168.248.169.2152: UDP, length 92
17:04:19.189781 IP 192.168.248.169.2152 > 192.168.248.50.2152: UDP, length 92
17:04:20.186129 IP 192.168.248.50.2152 > 192.168.248.169.2152: UDP, length 92
17:04:20.194167 IP 192.168.248.169.2152 > 192.168.248.50.2152: UDP, length 92
17:04:20.331008 IP 192.168.247.112.36412 > 192.168.247.50.36412: sctp (1) [HB ACK] 
17:04:21.180016 IP 192.168.248.50.2152 > 192.168.248.169.2152: UDP, length 92
17:04:21.188379 IP 192.168.248.169.2152 > 192.168.248.50.2152: UDP, length 92
17:04:21.327579 ARP, Request who-has 192.168.248.50 tell 192.168.248.169, length 46
17:04:21.329918 ARP, Reply 192.168.248.50 is-at 00:80:8e:8d:90:ab (oui Unknown), length 46
17:04:22.205947 IP 192.168.248.50.2152 > 192.168.248.169.2152: UDP, length 92
17:04:22.215842 IP 192.168.248.169.2152 > 192.168.248.50.2152: UDP, length 92
17:04:23.195686 IP 192.168.248.50.2152 > 192.168.248.169.2152: UDP, length 92
17:04:23.209011 IP 192.168.248.169.2152 > 192.168.248.50.2152: UDP, length 92
17:04:24.205623 IP 192.168.248.50.2152 > 192.168.248.169.2152: UDP, length 92
17:04:24.216732 IP 192.168.248.169.2152 > 192.168.248.50.2152: UDP, length 92
17:04:25.202867 IP 192.168.248.50.2152 > 192.168.248.169.2152: UDP, length 92
17:04:25.220261 IP 192.168.248.169.2152 > 192.168.248.50.2152: UDP, length 92
17:04:26.206360 IP 192.168.248.50.2152 > 192.168.248.169.2152: UDP, length 92
17:04:26.221393 IP 192.168.248.169.2152 > 192.168.248.50.2152: UDP, length 92
17:04:27.195322 IP 192.168.248.50.2152 > 192.168.248.169.2152: UDP, length 92
17:04:27.206707 IP 192.168.248.169.2152 > 192.168.248.50.2152: UDP, length 92
17:04:28.207880 IP 192.168.248.50.2152 > 192.168.248.169.2152: UDP, length 92
17:04:28.216564 IP 192.168.248.169.2152 > 192.168.248.50.2152: UDP, length 92
17:04:29.206296 IP 192.168.248.50.2152 > 192.168.248.169.2152: UDP, length 92
17:04:29.216316 IP 192.168.248.169.2152 > 192.168.248.50.2152: UDP, length 92
17:04:30.219064 IP 192.168.248.50.2152 > 192.168.248.169.2152: UDP, length 92
17:04:30.227551 IP 192.168.248.169.2152 > 192.168.248.50.2152: UDP, length 92
17:04:31.249269 IP 192.168.248.50.2152 > 192.168.248.169.2152: UDP, length 92
17:04:31.256293 IP 192.168.248.169.2152 > 192.168.248.50.2152: UDP, length 92
17:04:32.214993 IP 192.168.248.50.2152 > 192.168.248.169.2152: UDP, length 92
17:04:32.226682 IP 192.168.248.169.2152 > 192.168.248.50.2152: UDP, length 92
17:04:33.294314 IP 192.168.248.50.2152 > 192.168.248.169.2152: UDP, length 92
17:04:33.305360 IP 192.168.248.169.2152 > 192.168.248.50.2152: UDP, length 92
17:04:33.638700 ARP, Request who-has 192.168.248.169 tell 192.168.248.50, length 46
17:04:33.641999 ARP, Reply 192.168.248.169 is-at fa:16:3e:30:1e:d4 (oui Unknown), length 46
17:04:34.215353 IP 192.168.248.50.2152 > 192.168.248.169.2152: UDP, length 92
17:04:34.223654 IP 192.168.248.169.2152 > 192.168.248.50.2152: UDP, length 92
17:04:35.226124 IP 192.168.248.50.2152 > 192.168.248.169.2152: UDP, length 92
17:04:35.235769 IP 192.168.248.169.2152 > 192.168.248.50.2152: UDP, length 92
17:04:36.260296 IP 192.168.248.50.2152 > 192.168.248.169.2152: UDP, length 92
17:04:36.271849 IP 192.168.248.169.2152 > 192.168.248.50.2152: UDP, length 92
17:04:37.332118 IP 192.168.248.50.2152 > 192.168.248.169.2152: UDP, length 92
17:04:37.341256 IP 192.168.248.169.2152 > 192.168.248.50.2152: UDP, length 92
17:04:38.309217 IP 192.168.248.50.2152 > 192.168.248.169.2152: UDP, length 92
17:04:38.323049 IP 192.168.248.169.2152 > 192.168.248.50.2152: UDP, length 92
17:04:39.235856 IP 192.168.248.50.2152 > 192.168.248.169.2152: UDP, length 92
17:04:39.246820 IP 192.168.248.169.2152 > 192.168.248.50.2152: UDP, length 92
17:04:40.388635 IP 192.168.248.50.2152 > 192.168.248.169.2152: UDP, length 92
17:04:40.395994 IP 192.168.248.169.2152 > 192.168.248.50.2152: UDP, length 92
17:04:41.331941 IP 192.168.248.50.2152 > 192.168.248.169.2152: UDP, length 92
17:04:41.342470 IP 192.168.248.169.2152 > 192.168.248.50.2152: UDP, length 92
17:04:42.323880 IP 192.168.248.50.2152 > 192.168.248.169.2152: UDP, length 92
17:04:42.333812 IP 192.168.248.169.2152 > 192.168.248.50.2152: UDP, length 92
17:04:43.110443 IP 192.168.247.112.36412 > 192.168.247.50.36412: sctp (1) [HB REQ] 
17:04:43.236791 IP 192.168.248.50.2152 > 192.168.248.169.2152: UDP, length 92
17:04:43.245416 IP 192.168.248.169.2152 > 192.168.248.50.2152: UDP, length 92
17:04:44.246792 IP 192.168.248.50.2152 > 192.168.248.169.2152: UDP, length 92
17:04:44.260703 IP 192.168.248.169.2152 > 192.168.248.50.2152: UDP, length 92
17:04:45.247305 IP 192.168.248.50.2152 > 192.168.248.169.2152: UDP, length 92
17:04:45.256656 IP 192.168.248.169.2152 > 192.168.248.50.2152: UDP, length 92
17:04:45.647910 ARP, Request who-has 192.168.248.50 tell 192.168.248.169, length 46
17:04:45.650002 ARP, Reply 192.168.248.50 is-at 00:80:8e:8d:90:ab (oui Unknown), length 46
17:04:46.245935 IP 192.168.248.50.2152 > 192.168.248.169.2152: UDP, length 92
17:04:46.256133 IP 192.168.248.169.2152 > 192.168.248.50.2152: UDP, length 92
17:04:47.247034 IP 192.168.248.50.2152 > 192.168.248.169.2152: UDP, length 92
17:04:47.255490 IP 192.168.248.169.2152 > 192.168.248.50.2152: UDP, length 92
17:04:48.256361 IP 192.168.248.50.2152 > 192.168.248.169.2152: UDP, length 92
17:04:48.265791 IP 192.168.248.169.2152 > 192.168.248.50.2152: UDP, length 92
17:04:48.490896 ARP, Reply 192.168.247.112 is-at fa:16:3e:a5:1d:5e (oui Unknown), length 46
17:04:49.256227 IP 192.168.248.50.2152 > 192.168.248.169.2152: UDP, length 92
17:04:49.271030 IP 192.168.248.169.2152 > 192.168.248.50.2152: UDP, length 92
17:04:50.248838 IP 192.168.248.50.2152 > 192.168.248.169.2152: UDP, length 92
17:04:50.257354 IP 192.168.248.169.2152 > 192.168.248.50.2152: UDP, length 92
17:04:51.344039 IP 192.168.248.50.2152 > 192.168.248.169.2152: UDP, length 92
17:04:51.358414 IP 192.168.248.169.2152 > 192.168.248.50.2152: UDP, length 92
17:04:52.077592 IP 192.168.247.112.36412 > 192.168.247.50.36412: sctp (1) [HB ACK] 
17:04:52.337953 IP 192.168.248.50.2152 > 192.168.248.169.2152: UDP, length 92
17:04:52.348285 IP 192.168.248.169.2152 > 192.168.248.50.2152: UDP, length 92
17:04:53.257726 IP 192.168.248.50.2152 > 192.168.248.169.2152: UDP, length 92
17:04:53.268393 IP 192.168.248.169.2152 > 192.168.248.50.2152: UDP, length 92
17:04:54.266465 IP 192.168.248.50.2152 > 192.168.248.169.2152: UDP, length 92
17:04:54.276281 IP 192.168.248.169.2152 > 192.168.248.50.2152: UDP, length 92
17:04:55.266092 IP 192.168.248.50.2152 > 192.168.248.169.2152: UDP, length 92
17:04:55.275499 IP 192.168.248.169.2152 > 192.168.248.50.2152: UDP, length 92
17:04:56.266099 IP 192.168.248.50.2152 > 192.168.248.169.2152: UDP, length 92
17:04:56.279526 IP 192.168.248.169.2152 > 192.168.248.50.2152: UDP, length 92
17:04:57.189111 ARP, Request who-has 192.168.247.50 tell 192.168.247.112, length 46
17:04:57.268790 IP 192.168.248.50.2152 > 192.168.248.169.2152: UDP, length 92
17:04:57.280094 IP 192.168.248.169.2152 > 192.168.248.50.2152: UDP, length 92
17:04:58.276144 IP 192.168.248.50.2152 > 192.168.248.169.2152: UDP, length 92
17:04:58.285472 IP 192.168.248.169.2152 > 192.168.248.50.2152: UDP, length 92
17:04:59.276600 IP 192.168.248.50.2152 > 192.168.248.169.2152: UDP, length 92
17:04:59.288774 IP 192.168.248.169.2152 > 192.168.248.50.2152: UDP, length 92
17:05:00.278040 IP 192.168.248.50.2152 > 192.168.248.169.2152: UDP, length 92
17:05:00.287150 IP 192.168.248.169.2152 > 192.168.248.50.2152: UDP, length 92
17:05:01.300935 IP 192.168.248.50.2152 > 192.168.248.169.2152: UDP, length 92
17:05:01.302269 IP 192.168.248.169.2152 > 192.168.248.50.2152: UDP, length 92
17:05:02.297472 IP 192.168.248.50.2152 > 192.168.248.169.2152: UDP, length 92
17:05:02.362868 IP 192.168.248.169.2152 > 192.168.248.50.2152: UDP, length 92
17:05:03.285773 IP 192.168.248.50.2152 > 192.168.248.169.2152: UDP, length 92
17:05:03.296891 IP 192.168.248.169.2152 > 192.168.248.50.2152: UDP, length 92
17:05:04.278857 IP 192.168.248.50.2152 > 192.168.248.169.2152: UDP, length 92
17:05:04.291432 IP 192.168.248.169.2152 > 192.168.248.50.2152: UDP, length 92
17:05:05.288078 IP 192.168.248.50.2152 > 192.168.248.169.2152: UDP, length 92
17:05:05.298901 IP 192.168.248.169.2152 > 192.168.248.50.2152: UDP, length 92
17:05:05.384233 ARP, Request who-has 192.168.248.169 tell 192.168.248.50, length 46
17:05:05.387148 ARP, Reply 192.168.248.169 is-at fa:16:3e:30:1e:d4 (oui Unknown), length 46
17:05:06.284122 IP 192.168.248.50.2152 > 192.168.248.169.2152: UDP, length 92
17:05:06.299388 IP 192.168.248.169.2152 > 192.168.248.50.2152: UDP, length 92
17:05:07.291086 IP 192.168.248.50.2152 > 192.168.248.169.2152: UDP, length 92
17:05:07.308027 IP 192.168.248.169.2152 > 192.168.248.50.2152: UDP, length 92
17:05:08.323202 IP 192.168.248.50.2152 > 192.168.248.169.2152: UDP, length 92
17:05:08.341826 IP 192.168.248.169.2152 > 192.168.248.50.2152: UDP, length 92
17:05:09.306095 IP 192.168.248.50.2152 > 192.168.248.169.2152: UDP, length 92
17:05:09.316117 IP 192.168.248.169.2152 > 192.168.248.50.2152: UDP, length 92
17:05:10.299932 IP 192.168.248.50.2152 > 192.168.248.169.2152: UDP, length 92
17:05:10.312696 IP 192.168.248.169.2152 > 192.168.248.50.2152: UDP, length 92
17:05:10.481621 ARP, Request who-has 192.168.248.50 tell 192.168.248.169, length 46
17:05:10.489778 ARP, Reply 192.168.248.50 is-at 00:80:8e:8d:90:ab (oui Unknown), length 46
17:05:11.306340 IP 192.168.248.50.2152 > 192.168.248.169.2152: UDP, length 92
17:05:11.321448 IP 192.168.248.169.2152 > 192.168.248.50.2152: UDP, length 92
17:05:12.307105 IP 192.168.248.50.2152 > 192.168.248.169.2152: UDP, length 92
17:05:12.318777 IP 192.168.248.169.2152 > 192.168.248.50.2152: UDP, length 92
17:05:13.315901 IP 192.168.248.50.2152 > 192.168.248.169.2152: UDP, length 92
17:05:13.327729 IP 192.168.248.169.2152 > 192.168.248.50.2152: UDP, length 92
17:05:14.319284 IP 192.168.248.50.2152 > 192.168.248.169.2152: UDP, length 92
17:05:14.329010 IP 192.168.248.169.2152 > 192.168.248.50.2152: UDP, length 92
17:05:15.320726 IP 192.168.248.50.2152 > 192.168.248.169.2152: UDP, length 92
17:05:15.340337 IP 192.168.248.169.2152 > 192.168.248.50.2152: UDP, length 92
17:05:15.883999 IP 192.168.247.112.36412 > 192.168.247.50.36412: sctp (1) [HB REQ] 
17:05:16.317181 IP 192.168.248.50.2152 > 192.168.248.169.2152: UDP, length 92
17:05:16.351661 IP 192.168.248.169.2152 > 192.168.248.50.2152: UDP, length 92
17:05:17.317739 IP 192.168.248.50.2152 > 192.168.248.169.2152: UDP, length 92
17:05:17.330033 IP 192.168.248.169.2152 > 192.168.248.50.2152: UDP, length 92
17:05:18.314712 IP 192.168.248.50.2152 > 192.168.248.169.2152: UDP, length 92
17:05:18.325460 IP 192.168.248.169.2152 > 192.168.248.50.2152: UDP, length 92
17:05:19.317978 IP 192.168.248.50.2152 > 192.168.248.169.2152: UDP, length 92
17:05:19.335282 IP 192.168.248.169.2152 > 192.168.248.50.2152: UDP, length 92
17:05:20.326692 IP 192.168.248.50.2152 > 192.168.248.169.2152: UDP, length 92
17:05:20.337047 IP 192.168.248.169.2152 > 192.168.248.50.2152: UDP, length 92
17:05:21.260361 ARP, Reply 192.168.247.112 is-at fa:16:3e:a5:1d:5e (oui Unknown), length 46
17:05:21.329678 IP 192.168.248.50.2152 > 192.168.248.169.2152: UDP, length 92
17:05:21.345676 IP 192.168.248.169.2152 > 192.168.248.50.2152: UDP, length 92
17:05:22.336009 IP 192.168.248.50.2152 > 192.168.248.169.2152: UDP, length 92
17:05:22.345658 IP 192.168.248.169.2152 > 192.168.248.50.2152: UDP, length 92
17:05:22.793892 IP 192.168.247.112.36412 > 192.168.247.50.36412: sctp (1) [HB ACK] 
17:05:23.339560 IP 192.168.248.50.2152 > 192.168.248.169.2152: UDP, length 92
17:05:23.347890 IP 192.168.248.169.2152 > 192.168.248.50.2152: UDP, length 92
17:05:24.335844 IP 192.168.248.50.2152 > 192.168.248.169.2152: UDP, length 92
17:05:24.348468 IP 192.168.248.169.2152 > 192.168.248.50.2152: UDP, length 92
17:05:25.346060 IP 192.168.248.50.2152 > 192.168.248.169.2152: UDP, length 92
17:05:25.359080 IP 192.168.248.169.2152 > 192.168.248.50.2152: UDP, length 92
17:05:26.338988 IP 192.168.248.50.2152 > 192.168.248.169.2152: UDP, length 92
17:05:26.348140 IP 192.168.248.169.2152 > 192.168.248.50.2152: UDP, length 92
17:05:27.468105 IP 192.168.248.50.2152 > 192.168.248.169.2152: UDP, length 92
17:05:27.477239 IP 192.168.248.169.2152 > 192.168.248.50.2152: UDP, length 92
17:05:28.345924 IP 192.168.248.50.2152 > 192.168.248.169.2152: UDP, length 92
17:05:28.357011 IP 192.168.248.169.2152 > 192.168.248.50.2152: UDP, length 92
17:05:29.346500 IP 192.168.248.50.2152 > 192.168.248.169.2152: UDP, length 92
17:05:29.363790 IP 192.168.248.169.2152 > 192.168.248.50.2152: UDP, length 92
17:05:30.338346 IP 192.168.248.50.2152 > 192.168.248.169.2152: UDP, length 92
17:05:30.347798 IP 192.168.248.169.2152 > 192.168.248.50.2152: UDP, length 92
17:05:31.355941 IP 192.168.248.50.2152 > 192.168.248.169.2152: UDP, length 92
17:05:31.365028 IP 192.168.248.169.2152 > 192.168.248.50.2152: UDP, length 92
17:05:32.356613 IP 192.168.248.50.2152 > 192.168.248.169.2152: UDP, length 92
17:05:32.374674 IP 192.168.248.169.2152 > 192.168.248.50.2152: UDP, length 92
17:05:33.344974 IP 192.168.248.50.2152 > 192.168.248.169.2152: UDP, length 92
17:05:33.356011 IP 192.168.248.169.2152 > 192.168.248.50.2152: UDP, length 92
17:05:34.348820 IP 192.168.248.50.2152 > 192.168.248.169.2152: UDP, length 92
17:05:34.358706 IP 192.168.248.169.2152 > 192.168.248.50.2152: UDP, length 92
17:05:34.543479 ARP, Request who-has 192.168.248.50 tell 192.168.248.169, length 46
17:05:34.545576 ARP, Reply 192.168.248.50 is-at 00:80:8e:8d:90:ab (oui Unknown), length 46
17:05:35.358320 IP 192.168.248.50.2152 > 192.168.248.169.2152: UDP, length 92
17:05:35.373449 IP 192.168.248.169.2152 > 192.168.248.50.2152: UDP, length 92
17:05:36.358023 IP 192.168.248.50.2152 > 192.168.248.169.2152: UDP, length 92
17:05:36.368515 IP 192.168.248.169.2152 > 192.168.248.50.2152: UDP, length 92
17:05:37.365761 IP 192.168.248.50.2152 > 192.168.248.169.2152: UDP, length 92
17:05:37.379038 IP 192.168.248.169.2152 > 192.168.248.50.2152: UDP, length 92
17:05:37.642702 ARP, Request who-has 192.168.248.169 tell 192.168.248.50, length 46
17:05:37.643252 ARP, Reply 192.168.248.169 is-at fa:16:3e:30:1e:d4 (oui Unknown), length 46
17:05:38.358422 IP 192.168.248.50.2152 > 192.168.248.169.2152: UDP, length 92
17:05:38.370187 IP 192.168.248.169.2152 > 192.168.248.50.2152: UDP, length 92
17:05:39.365867 IP 192.168.248.50.2152 > 192.168.248.169.2152: UDP, length 92
17:05:39.383125 IP 192.168.248.169.2152 > 192.168.248.50.2152: UDP, length 92
17:05:40.370019 IP 192.168.248.50.2152 > 192.168.248.169.2152: UDP, length 92
17:05:40.380655 IP 192.168.248.169.2152 > 192.168.248.50.2152: UDP, length 92
17:05:41.377363 IP 192.168.248.50.2152 > 192.168.248.169.2152: UDP, length 92
17:05:41.388989 IP 192.168.248.169.2152 > 192.168.248.50.2152: UDP, length 92
17:05:42.376651 IP 192.168.248.50.2152 > 192.168.248.169.2152: UDP, length 92
17:05:42.391604 IP 192.168.248.169.2152 > 192.168.248.50.2152: UDP, length 92
17:05:43.386333 IP 192.168.248.50.2152 > 192.168.248.169.2152: UDP, length 92
17:05:43.397763 IP 192.168.248.169.2152 > 192.168.248.50.2152: UDP, length 92
17:05:44.376101 IP 192.168.248.50.2152 > 192.168.248.169.2152: UDP, length 92
17:05:44.389812 IP 192.168.248.169.2152 > 192.168.248.50.2152: UDP, length 92
17:05:45.386265 IP 192.168.248.50.2152 > 192.168.248.169.2152: UDP, length 92
17:05:45.398242 IP 192.168.248.169.2152 > 192.168.248.50.2152: UDP, length 92
17:05:46.385658 IP 192.168.248.50.2152 > 192.168.248.169.2152: UDP, length 92
17:05:46.400616 IP 192.168.248.169.2152 > 192.168.248.50.2152: UDP, length 92
17:05:47.386007 IP 192.168.248.50.2152 > 192.168.248.169.2152: UDP, length 92
17:05:47.393281 IP 192.168.248.169.2152 > 192.168.248.50.2152: UDP, length 92
17:05:48.398781 IP 192.168.248.50.2152 > 192.168.248.169.2152: UDP, length 92
17:05:48.408578 IP 192.168.248.169.2152 > 192.168.248.50.2152: UDP, length 92
17:05:48.647109 IP 192.168.247.112.36412 > 192.168.247.50.36412: sctp (1) [HB REQ] 
17:05:49.410889 IP 192.168.248.50.2152 > 192.168.248.169.2152: UDP, length 92
17:05:49.411793 IP 192.168.248.169.2152 > 192.168.248.50.2152: UDP, length 92
17:05:50.388265 IP 192.168.248.50.2152 > 192.168.248.169.2152: UDP, length 92
17:05:50.397720 IP 192.168.248.169.2152 > 192.168.248.50.2152: UDP, length 92
17:05:51.391967 IP 192.168.248.50.2152 > 192.168.248.169.2152: UDP, length 92
17:05:51.412274 IP 192.168.248.169.2152 > 192.168.248.50.2152: UDP, length 92
17:05:52.398763 IP 192.168.248.50.2152 > 192.168.248.169.2152: UDP, length 92
17:05:52.410259 IP 192.168.248.169.2152 > 192.168.248.50.2152: UDP, length 92
17:05:53.397025 IP 192.168.248.50.2152 > 192.168.248.169.2152: UDP, length 92
17:05:53.408615 IP 192.168.248.169.2152 > 192.168.248.50.2152: UDP, length 92
17:05:54.027026 ARP, Reply 192.168.247.112 is-at fa:16:3e:a5:1d:5e (oui Unknown), length 46
17:05:54.398517 IP 192.168.248.50.2152 > 192.168.248.169.2152: UDP, length 92
17:05:54.408653 IP 192.168.248.169.2152 > 192.168.248.50.2152: UDP, length 92
17:05:54.538529 IP 192.168.247.112.36412 > 192.168.247.50.36412: sctp (1) [HB ACK] 
17:05:55.405744 IP 192.168.248.50.2152 > 192.168.248.169.2152: UDP, length 92
17:05:55.418771 IP 192.168.248.169.2152 > 192.168.248.50.2152: UDP, length 92
17:05:56.415909 IP 192.168.248.50.2152 > 192.168.248.169.2152: UDP, length 92
17:05:56.427712 IP 192.168.248.169.2152 > 192.168.248.50.2152: UDP, length 92
17:05:57.415659 IP 192.168.248.50.2152 > 192.168.248.169.2152: UDP, length 92
17:05:57.425184 IP 192.168.248.169.2152 > 192.168.248.50.2152: UDP, length 92
17:05:58.415727 IP 192.168.248.50.2152 > 192.168.248.169.2152: UDP, length 92
17:05:58.424927 IP 192.168.248.169.2152 > 192.168.248.50.2152: UDP, length 92
17:05:59.416675 IP 192.168.248.50.2152 > 192.168.248.169.2152: UDP, length 92
17:05:59.425735 IP 192.168.248.169.2152 > 192.168.248.50.2152: UDP, length 92
17:05:59.651915 ARP, Request who-has 192.168.247.50 tell 192.168.247.112, length 46
17:06:00.425673 IP 192.168.248.50.2152 > 192.168.248.169.2152: UDP, length 92
17:06:00.435081 IP 192.168.248.169.2152 > 192.168.248.50.2152: UDP, length 92
17:06:01.425724 IP 192.168.248.50.2152 > 192.168.248.169.2152: UDP, length 92
17:06:01.435007 IP 192.168.248.169.2152 > 192.168.248.50.2152: UDP, length 92
17:06:02.427001 IP 192.168.248.50.2152 > 192.168.248.169.2152: UDP, length 92
17:06:02.439489 IP 192.168.248.169.2152 > 192.168.248.50.2152: UDP, length 92
17:06:03.426434 IP 192.168.248.50.2152 > 192.168.248.169.2152: UDP, length 92
17:06:03.453904 IP 192.168.248.169.2152 > 192.168.248.50.2152: UDP, length 92
17:06:03.470838 ARP, Request who-has 192.168.248.50 tell 192.168.248.169, length 46
17:06:03.477039 ARP, Reply 192.168.248.50 is-at 00:80:8e:8d:90:ab (oui Unknown), length 46
17:06:04.423960 IP 192.168.248.50.2152 > 192.168.248.169.2152: UDP, length 92
17:06:04.440017 IP 192.168.248.169.2152 > 192.168.248.50.2152: UDP, length 92
17:06:05.435589 IP 192.168.248.50.2152 > 192.168.248.169.2152: UDP, length 92
17:06:05.463047 IP 192.168.248.169.2152 > 192.168.248.50.2152: UDP, length 92
17:06:06.723377 IP 192.168.248.50.2152 > 192.168.248.169.2152: UDP, length 92
17:06:06.728521 IP 192.168.248.169.2152 > 192.168.248.50.2152: UDP, length 92
17:06:07.428780 IP 192.168.248.50.2152 > 192.168.248.169.2152: UDP, length 92
17:06:07.448194 IP 192.168.248.169.2152 > 192.168.248.50.2152: UDP, length 92
17:06:08.431380 IP 192.168.248.50.2152 > 192.168.248.169.2152: UDP, length 92
17:06:08.467834 IP 192.168.248.169.2152 > 192.168.248.50.2152: UDP, length 92
17:06:09.434344 IP 192.168.248.50.2152 > 192.168.248.169.2152: UDP, length 92
17:06:09.444943 IP 192.168.248.169.2152 > 192.168.248.50.2152: UDP, length 92
17:06:09.894534 ARP, Request who-has 192.168.248.169 tell 192.168.248.50, length 46
17:06:09.897359 ARP, Reply 192.168.248.169 is-at fa:16:3e:30:1e:d4 (oui Unknown), length 46
17:06:10.440872 IP 192.168.248.50.2152 > 192.168.248.169.2152: UDP, length 92
17:06:10.450479 IP 192.168.248.169.2152 > 192.168.248.50.2152: UDP, length 92
17:06:11.437632 IP 192.168.248.50.2152 > 192.168.248.169.2152: UDP, length 92
17:06:11.447899 IP 192.168.248.169.2152 > 192.168.248.50.2152: UDP, length 92
17:06:12.442752 IP 192.168.248.50.2152 > 192.168.248.169.2152: UDP, length 92
17:06:12.452388 IP 192.168.248.169.2152 > 192.168.248.50.2152: UDP, length 92
17:06:13.446155 IP 192.168.248.50.2152 > 192.168.248.169.2152: UDP, length 92
17:06:13.469909 IP 192.168.248.169.2152 > 192.168.248.50.2152: UDP, length 92
17:06:14.450726 IP 192.168.248.50.2152 > 192.168.248.169.2152: UDP, length 92
17:06:14.456732 IP 192.168.248.169.2152 > 192.168.248.50.2152: UDP, length 92
17:06:15.456369 IP 192.168.248.50.2152 > 192.168.248.169.2152: UDP, length 92
17:06:15.464372 IP 192.168.248.169.2152 > 192.168.248.50.2152: UDP, length 92
17:06:16.447732 IP 192.168.248.50.2152 > 192.168.248.169.2152: UDP, length 92
17:06:16.455853 IP 192.168.248.169.2152 > 192.168.248.50.2152: UDP, length 92
17:06:17.448001 IP 192.168.248.50.2152 > 192.168.248.169.2152: UDP, length 92
17:06:17.458281 IP 192.168.248.169.2152 > 192.168.248.50.2152: UDP, length 92
17:06:18.456210 IP 192.168.248.50.2152 > 192.168.248.169.2152: UDP, length 92
17:06:18.464390 IP 192.168.248.169.2152 > 192.168.248.50.2152: UDP, length 92
17:06:19.455851 IP 192.168.248.50.2152 > 192.168.248.169.2152: UDP, length 92
17:06:19.465317 IP 192.168.248.169.2152 > 192.168.248.50.2152: UDP, length 92
17:06:20.447856 IP 192.168.248.50.2152 > 192.168.248.169.2152: UDP, length 92
17:06:20.457155 IP 192.168.248.169.2152 > 192.168.248.50.2152: UDP, length 92
17:06:21.413737 IP 192.168.247.112.36412 > 192.168.247.50.36412: sctp (1) [HB REQ] 
17:06:21.456506 IP 192.168.248.50.2152 > 192.168.248.169.2152: UDP, length 92
17:06:21.465165 IP 192.168.248.169.2152 > 192.168.248.50.2152: UDP, length 92
17:06:22.447309 IP 192.168.248.50.2152 > 192.168.248.169.2152: UDP, length 92
17:06:22.456031 IP 192.168.248.169.2152 > 192.168.248.50.2152: UDP, length 92
17:06:23.455986 IP 192.168.248.50.2152 > 192.168.248.169.2152: UDP, length 92
17:06:23.465485 IP 192.168.248.169.2152 > 192.168.248.50.2152: UDP, length 92
17:06:24.465805 IP 192.168.248.50.2152 > 192.168.248.169.2152: UDP, length 92
17:06:24.514502 IP 192.168.248.169.2152 > 192.168.248.50.2152: UDP, length 92
17:06:25.257663 IP 192.168.247.112.36412 > 192.168.247.50.36412: sctp (1) [HB ACK] 
17:06:25.455987 IP 192.168.248.50.2152 > 192.168.248.169.2152: UDP, length 92
17:06:25.467859 IP 192.168.248.169.2152 > 192.168.248.50.2152: UDP, length 92
17:06:26.455630 IP 192.168.248.50.2152 > 192.168.248.169.2152: UDP, length 92
17:06:26.477416 IP 192.168.248.169.2152 > 192.168.248.50.2152: UDP, length 92
17:06:26.792902 ARP, Reply 192.168.247.112 is-at fa:16:3e:a5:1d:5e (oui Unknown), length 46
17:06:27.465607 IP 192.168.248.50.2152 > 192.168.248.169.2152: UDP, length 92
17:06:27.473872 IP 192.168.248.169.2152 > 192.168.248.50.2152: UDP, length 92
17:06:28.451707 IP 192.168.248.50.2152 > 192.168.248.169.2152: UDP, length 92
17:06:28.462303 IP 192.168.248.169.2152 > 192.168.248.50.2152: UDP, length 92
17:06:29.465616 IP 192.168.248.50.2152 > 192.168.248.169.2152: UDP, length 92
17:06:29.473525 IP 192.168.248.169.2152 > 192.168.248.50.2152: UDP, length 92
17:06:30.457334 IP 192.168.248.50.2152 > 192.168.248.169.2152: UDP, length 92
17:06:30.465635 IP 192.168.248.169.2152 > 192.168.248.50.2152: UDP, length 92
17:06:31.467636 IP 192.168.248.50.2152 > 192.168.248.169.2152: UDP, length 92
17:06:31.478005 IP 192.168.248.169.2152 > 192.168.248.50.2152: UDP, length 92
17:06:32.458178 IP 192.168.248.50.2152 > 192.168.248.169.2152: UDP, length 92
17:06:32.467986 IP 192.168.248.169.2152 > 192.168.248.50.2152: UDP, length 92
17:06:32.655550 ARP, Request who-has 192.168.248.50 tell 192.168.248.169, 