17:03:52.114926 IP 192.168.248.50.2152 > 192.168.248.169.2152: UDP, length 92
17:03:52.125986 IP 192.168.248.169.2152 > 192.168.248.50.2152: UDP, length 92
17:03:53.128194 IP 192.168.248.50.2152 > 192.168.248.169.2152: UDP, length 92
17:03:53.140604 IP 192.168.248.169.2152 > 192.168.248.50.2152: UDP, length 92
17:03:54.128223 IP 192.168.248.50.2152 > 192.168.248.169.2152: UDP, length 92
17:03:54.137180 IP 192.168.248.169.2152 > 192.168.248.50.2152: UDP, length 92
17:03:54.213022 ARP, Request who-has 192.168.247.50 tell 192.168.247.112, length 46
17:03:55.136165 IP 192.168.248.50.2152 > 192.168.248.169.2152: UDP, length 92
17:03:55.147003 IP 192.168.248.169.2152 > 192.168.248.50.2152: UDP, length 92
17:03:56.136805 IP 192.168.248.50.2152 > 192.168.248.169.2152: UDP, length 92
17:03:56.144015 IP 192.168.248.169.2152 > 192.168.248.50.2152: UDP, length 92
17:03:56.241280 ARP, Request who-has 192.168.248.50 tell 192.168.248.169, length 46
17:03:56.243252 ARP, Reply 192.168.248.50 is-at 00:80:8e:8d:90:ab (oui Unknown), length 46
17:03:57.136772 IP 192.168.248.50.2152 > 192.168.248.169.2152: UDP, length 92
17:03:57.145132 IP 192.168.248.169.2152 > 192.168.248.50.2152: UDP, length 92
17:03:58.136396 IP 192.168.248.50.2152 > 192.168.248.169.2152: UDP, length 92
17:03:58.145509 IP 192.168.248.169.2152 > 192.168.248.50.2152: UDP, length 92
17:03:59.128772 IP 192.168.248.50.2152 > 192.168.248.169.2152: UDP, length 92
17:03:59.138000 IP 192.168.248.169.2152 > 192.168.248.50.2152: UDP, length 92
17:04:00.068387 IP 192.168.248.50.2152 > 192.168.248.169.2152: UDP, length 92
17:04:00.078036 IP 192.168.248.169.2152 > 192.168.248.50.2152: UDP, length 92
17:04:01.135773 IP 192.168.248.50.2152 > 192.168.248.169.2152: UDP, length 92
17:04:01.150234 IP 192.168.248.169.2152 > 192.168.248.50.2152: UDP, length 92
17:04:01.383493 ARP, Request who-has 192.168.248.169 tell 192.168.248.50, length 46
17:04:01.387176 ARP, Reply 192.168.248.169 is-at fa:16:3e:30:1e:d4 (oui Unknown), length 46
17:04:02.297282 IP 192.168.248.50.2152 > 192.168.248.169.2152: UDP, length 92
17:04:02.307271 IP 192.168.248.169.2152 > 192.168.248.50.2152: UDP, length 92
17:04:03.143265 IP 192.168.248.50.2152 > 192.168.248.169.2152: UDP, length 92
17:04:03.162395 IP 192.168.248.169.2152 > 192.168.248.50.2152: UDP, length 92
17:04:04.157545 IP 192.168.248.50.2152 > 192.168.248.169.2152: UDP, length 92
17:04:04.187565 IP 192.168.248.169.2152 > 192.168.248.50.2152: UDP, length 92
17:04:05.148234 IP 192.168.248.50.2152 > 192.168.248.169.2152: UDP, length 92
17:04:05.157336 IP 192.168.248.169.2152 > 192.168.248.50.2152: UDP, length 92
17:04:06.207815 IP 192.168.248.50.2152 > 192.168.248.169.2152: UDP, length 92
17:04:06.207973 IP 192.168.248.169.2152 > 192.168.248.50.2152: UDP, length 92
17:04:07.158394 IP 192.168.248.50.2152 > 192.168.248.169.2152: UDP, length 92
17:04:07.166835 IP 192.168.248.169.2152 > 192.168.248.50.2152: UDP, length 92
17:04:08.157976 IP 192.168.248.50.2152 > 192.168.248.169.2152: UDP, length 92
17:04:08.168907 IP 192.168.248.169.2152 > 192.168.248.50.2152: UDP, length 92
17:04:09.154261 IP 192.168.248.50.2152 > 192.168.248.169.2152: UDP, length 92
17:04:09.163275 IP 192.168.248.169.2152 > 192.168.248.50.2152: UDP, length 92
17:04:10.165988 IP 192.168.248.50.2152 > 192.168.248.169.2152: UDP, length 92
17:04:10.177351 IP 192.168.248.169.2152 > 192.168.248.50.2152: UDP, length 92
17:04:10.344873 IP 192.168.247.112.36412 > 192.168.247.50.36412: sctp (1) [HB REQ] 
17:04:11.241992 IP 192.168.248.50.2152 > 192.168.248.169.2152: UDP, length 92
17:04:11.255249 IP 192.168.248.169.2152 > 192.168.248.50.2152: UDP, length 92
17:04:12.244745 IP 192.168.248.50.2152 > 192.168.248.169.2152: UDP, length 92
17:04:12.257853 IP 192.168.248.169.2152 > 192.168.248.50.2152: UDP, length 92
17:04:13.176399 IP 192.168.248.50.2152 > 192.168.248.169.2152: UDP, length 92
17:04:13.184850 IP 192.168.248.169.2152 > 192.168.248.50.2152: UDP, length 92
17:04:14.162671 IP 192.168.248.50.2152 > 192.168.248.169.2152: UDP, length 92
17:04:14.178395 IP 192.168.248.169.2152 > 192.168.248.50.2152: UDP, length 92
17:04:15.175971 IP 192.168.248.50.2152 > 192.168.248.169.2152: UDP, length 92
17:04:15.187195 IP 192.168.248.169.2152 > 192.168.248.50.2152: UDP, length 92
17:04:15.722309 ARP, Reply 192.168.247.112 is-at fa:16:3e:a5:1d:5e (oui Unknown), length 46
17:04:16.185791 IP 192.168.248.50.2152 > 192.168.248.169.2152: UDP, length 92
17:04:16.194748 IP 192.168.248.169.2152 > 192.168.248.50.2152: UDP, length 92
17:04:17.186057 IP 192.168.248.50.2152 > 192.168.248.169.2152: UDP, length 92
17:04:17.203109 IP 192.168.248.169.2152 > 192.168.248.50.2152: UDP, length 92
17:04:18.175885 IP 192.168.248.50.2152 > 192.168.248.169.2152: UDP, length 92
17:04:18.185704 IP 192.168.248.169.2152 > 192.168.248.50.2152: UDP, length 92
17:04:19.178541 IP 192.168.248.50.2152 > 192.168.248.169.2152: UDP, length 92
17:04:19.189781 IP 192.168.248.169.2152 > 192.168.248.50.2152: UDP, length 92
17:04:20.186129 IP 192.168.248.50.2152 > 192.168.248.169.2152: UDP, length 92
17:04:20.194167 IP 192.168.248.169.2152 > 192.168.248.50.2152: UDP, length 92
17:04:20.331008 IP 192.168.247.112.36412 > 192.168.247.50.36412: sctp (1) [HB ACK] 
17:04:21.180016 IP 192.168.248.50.2152 > 192.168.248.169.2152: UDP, length 92
17:04:21.188379 IP 192.168.248.169.2152 > 192.168.248.50.2152: UDP, length 92
17:04:21.327579 ARP, Request who-has 192.168.248.50 tell 192.168.248.169, length 46
17:04:21.329918 ARP, Reply 192.168.248.50 is-at 00:80:8e:8d:90:ab (oui Unknown), length 46
17:04:22.205947 IP 192.168.248.50.2152 > 192.168.248.169.2152: UDP, length 92
17:04:22.215842 IP 192.168.248.169.2152 > 192.168.248.50.2152: UDP, length 92
17:04:23.195686 IP 192.168.248.50.2152 > 192.168.248.169.2152: UDP, length 92
17:04:23.209011 IP 192.168.248.169.2152 > 192.168.248.50.2152: UDP, length 92
17:04:24.205623 IP 192.168.248.50.2152 > 192.168.248.169.2152: UDP, length 92
17:04:24.216732 IP 192.168.248.169.2152 > 192.168.248.50.2152: UDP, length 92
17:04:25.202867 IP 192.168.248.50.2152 > 192.168.248.169.2152: UDP, length 92
17:04:25.220261 IP 192.168.248.169.2152 > 192.168.248.50.2152: UDP, length 92
17:04:26.206360 IP 192.168.248.50.2152 > 192.168.248.169.2152: UDP, length 92
17:04:26.221393 IP 192.168.248.169.2152 > 192.168.248.50.2152: UDP, length 92
17:04:27.195322 IP 192.168.248.50.2152 > 192.168.248.169.2152: UDP, length 92
17:04:27.206707 IP 192.168.248.169.2152 > 192.168.248.50.2152: UDP, length 92
17:04:28.207880 IP 192.168.248.50.2152 > 192.168.248.169.2152: UDP, length 92
17:04:28.216564 IP 192.168.248.169.2152 > 192.168.248.50.2152: UDP, length 92
17:04:29.206296 IP 192.168.248.50.2152 > 192.168.248.169.2152: UDP, length 92
17:04:29.216316 IP 192.168.248.169.2152 > 192.168.248.50.2152: UDP, length 92
17:04:30.219064 IP 192.168.248.50.2152 > 192.168.248.169.2152: UDP, length 92
17:04:30.227551 IP 192.168.248.169.2152 > 192.168.248.50.2152: UDP, length 92
17:04:31.249269 IP 192.168.248.50.2152 > 192.168.248.169.2152: UDP, length 92
17:04:31.256293 IP 192.168.248.169.2152 > 192.168.248.50.2152: UDP, length 92
17:04:32.214993 IP 192.168.248.50.2152 > 192.168.248.169.2152: UDP, length 92
17:04:32.226682 IP 192.168.248.169.2152 > 192.168.248.50.2152: UDP, length 92
17:04:33.294314 IP 192.168.248.50.2152 > 192.168.248.169.2152: UDP, length 92
17:04:33.305360 IP 192.168.248.169.2152 > 192.168.248.50.2152: UDP, length 92
17:04:33.638700 ARP, Request who-has 192.168.248.169 tell 192.168.248.50, length 46
17:04:33.641999 ARP, Reply 192.168.248.169 is-at fa:16:3e:30:1e:d4 (oui Unknown), length 46
17:04:34.215353 IP 192.168.248.50.2152 > 192.168.248.169.2152: UDP, length 92
17:04:34.223654 IP 192.168.248.169.2152 > 192.168.248.50.2152: UDP, length 92
17:04:35.226124 IP 192.168.248.50.2152 > 192.168.248.169.2152: UDP, length 92
17:04:35.235769 IP 192.168.248.169.2152 > 192.168.248.50.2152: UDP, length 92
17:04:36.260296 IP 192.168.248.50.2152 > 192.168.248.169.2152: UDP, length 92
17:04:36.271849 IP 192.168.248.169.2152 > 192.168.248.50.2152: UDP, length 92
17:04:37.332118 IP 192.168.248.50.2152 > 192.168.248.169.2152: UDP, length 92
17:04:37.341256 IP 192.168.248.169.2152 > 192.168.248.50.2152: UDP, length 92
17:04:38.309217 IP 192.168.248.50.2152 > 192.168.248.169.2152: UDP, length 92
17:04:38.323049 IP 192.168.248.169.2152 > 192.168.248.50.2152: UDP, length 92
17:04:39.235856 IP 192.168.248.50.2152 > 192.168.248.169.2152: UDP, length 92
17:04:39.246820 IP 192.168.248.169.2152 > 192.168.248.50.2152: UDP, length 92
17:04:40.388635 IP 192.168.248.50.2152 > 192.168.248.169.2152: UDP, length 92
17:04:40.395994 IP 192.168.248.169.2152 > 192.168.248.50.2152: UDP, length 92
17:04:41.331941 IP 192.168.248.50.2152 > 192.168.248.169.2152: UDP, length 92
17:04:41.342470 IP 192.168.248.169.2152 > 192.168.248.50.2152: UDP, length 92
17:04:42.323880 IP 192.168.248.50.2152 > 192.168.248.169.2152: UDP, length 92
17:04:42.333812 IP 192.168.248.169.2152 > 192.168.248.50.2152: UDP, length 92
17:04:43.110443 IP 192.168.247.112.36412 > 192.168.247.50.36412: sctp (1) [HB REQ] 
17:04:43.236791 IP 192.168.248.50.2152 > 192.168.248.169.2152: UDP, length 92
17:04:43.245416 IP 192.168.248.169.2152 > 192.168.248.50.2152: UDP, length 92
17:04:44.246792 IP 192.168.248.50.2152 > 192.168.248.169.2152: UDP, length 92
17:04:44.260703 IP 192.168.248.169.2152 > 192.168.248.50.2152: UDP, length 92
17:04:45.247305 IP 192.168.248.50.2152 > 192.168.248.169.2152: UDP, length 92
17:04:45.256656 IP 192.168.248.169.2152 > 192.168.248.50.2152: UDP, length 92
17:04:45.647910 ARP, Request who-has 192.168.248.50 tell 192.168.248.169, length 46
17:04:45.650002 ARP, Reply 192.168.248.50 is-at 00:80:8e:8d:90:ab (oui Unknown), length 46
17:04:46.245935 IP 192.168.248.50.2152 > 192.168.248.169.2152: UDP, length 92
17:04:46.256133 IP 192.168.248.169.2152 > 192.168.248.50.2152: UDP, length 92
17:04:47.247034 IP 192.168.248.50.2152 > 192.168.248.169.2152: UDP, length 92
17:04:47.255490 IP 192.168.248.169.2152 > 192.168.248.50.2152: UDP, length 92
17:04:48.256361 IP 192.168.248.50.2152 > 192.168.248.169.2152: UDP, length 92
17:04:48.265791 IP 192.168.248.169.2152 > 192.168.248.50.2152: UDP, length 92
17:04:48.490896 ARP, Reply 192.168.247.112 is-at fa:16:3e:a5:1d:5e (oui Unknown), length 46
17:04:49.256227 IP 192.168.248.50.2152 > 192.168.248.169.2152: UDP, length 92
17:04:49.271030 IP 192.168.248.169.2152 > 192.168.248.50.2152: UDP, length 92
17:04:50.248838 IP 192.168.248.50.2152 > 192.168.248.169.2152: UDP, length 92
17:04:50.257354 IP 192.168.248.169.2152 > 192.168.248.50.2152: UDP, length 92
17:04:51.344039 IP 192.168.248.50.2152 > 192.168.248.169.2152: UDP, length 92
17:04:51.358414 IP 192.168.248.169.2152 > 192.168.248.50.2152: UDP, length 92
17:04:52.077592 IP 192.168.247.112.36412 > 192.168.247.50.36412: sctp (1) [HB ACK] 
17:04:52.337953 IP 192.168.248.50.2152 > 192.168.248.169.2152: UDP, length 92
17:04:52.348285 IP 192.168.248.169.2152 > 192.168.248.50.2152: UDP, length 92
17:04:53.257726 IP 192.168.248.50.2152 > 192.168.248.169.2152: UDP, length 92
17:04:53.268393 IP 192.168.248.169.2152 > 192.168.248.50.2152: UDP, length 92
17:04:54.266465 IP 192.168.248.50.2152 > 192.168.248.169.2152: UDP, length 92
17:04:54.276281 IP 192.168.248.169.2152 > 192.168.248.50.2152: UDP, length 92
17:04:55.266092 IP 192.168.248.50.2152 > 192.168.248.169.2152: UDP, length 92
17:04:55.275499 IP 192.168.248.169.2152 > 192.168.248.50.2152: UDP, length 92
17:04:56.266099 IP 192.168.248.50.2152 > 192.168.248.169.2152: UDP, length 92
17:04:56.279526 IP 192.168.248.169.2152 > 192.168.248.50.2152: UDP, length 92
17:04:57.189111 ARP, Request who-has 192.168.247.50 tell 192.168.247.112, length 46
17:04:57.268790 IP 192.168.248.50.2152 > 192.168.248.169.2152: UDP, length 92
17:04:57.280094 IP 192.168.248.169.2152 > 192.168.248.50.2152: UDP, length 92
17:04:58.276144 IP 192.168.248.50.2152 > 192.168.248.169.2152: UDP, length 92
17:04:58.285472 IP 192.168.248.169.2152 > 192.168.248.50.2152: UDP, length 92
17:04:59.276600 IP 192.168.248.50.2152 > 192.168.248.169.2152: UDP, length 92
17:04:59.288774 IP 192.168.248.169.2152 > 192.168.248.50.2152: UDP, length 92
17:05:00.278040 IP 192.168.248.50.2152 > 192.168.248.169.2152: UDP, length 92
17:05:00.287150 IP 192.168.248.169.2152 > 192.168.248.50.2152: UDP, length 92
17:05:01.300935 IP 192.168.248.50.2152 > 192.168.248.169.2152: UDP, length 92
17:05:01.302269 IP 192.168.248.169.2152 > 192.168.248.50.2152: UDP, length 92
17:05:02.297472 IP 192.168.248.50.2152 > 192.168.248.169.2152: UDP, length 92
17:05:02.362868 IP 192.168.248.169.2152 > 192.168.248.50.2152: UDP, length 92
17:05:03.285773 IP 192.168.248.50.2152 > 192.168.248.169.2152: UDP, length 92
17:05:03.296891 IP 192.168.248.169.2152 > 192.168.248.50.2152: UDP, length 92
17:05:04.278857 IP 192.168.248.50.2152 > 192.168.248.169.2152: UDP, length 92
17:05:04.291432 IP 192.168.248.169.2152 > 192.168.248.50.2152: UDP, length 92
17:05:05.288078 IP 192.168.248.50.2152 > 192.168.248.169.2152: UDP, length 92
17:05:05.298901 IP 192.168.248.169.2152 > 192.168.248.50.2152: UDP, length 92
17:05:05.384233 ARP, Request who-has 192.168.248.169 tell 192.168.248.50, length 46
17:05:05.387148 ARP, Reply 192.168.248.169 is-at fa:16:3e:30:1e:d4 (oui Unknown), length 46
17:05:06.284122 IP 192.168.248.50.2152 > 192.168.248.169.2152: UDP, length 92
17:05:06.299388 IP 192.168.248.169.2152 > 192.168.248.50.2152: UDP, length 92
17:05:07.291086 IP 192.168.248.50.2152 > 192.168.248.169.2152: UDP, length 92
17:05:07.308027 IP 192.168.248.169.2152 > 192.168.248.50.2152: UDP, length 92
17:05:08.323202 IP 192.168.248.50.2152 > 192.168.248.169.2152: UDP, length 92
17:05:08.341826 IP 192.168.248.169.2152 > 192.168.248.50.2152: UDP, length 92
17:05:09.306095 IP 192.168.248.50.2152 > 192.168.248.169.2152: UDP, length 92
17:05:09.316117 IP 192.168.248.169.2152 > 192.168.248.50.2152: UDP, length 92
17:05:10.299932 IP 192.168.248.50.2152 > 192.168.248.169.2152: UDP, length 92
17:05:10.312696 IP 192.168.248.169.2152 > 192.168.248.50.2152: UDP, length 92
17:05:10.481621 ARP, Request who-has 192.168.248.50 tell 192.168.248.169, length 46
17:05:10.489778 ARP, Reply 192.168.248.50 is-at 00:80:8e:8d:90:ab (oui Unknown), length 46
17:05:11.306340 IP 192.168.248.50.2152 > 192.168.248.169.2152: UDP, length 92
17:05:11.321448 IP 192.168.248.169.2152 > 192.168.248.50.2152: UDP, length 92
17:05:12.307105 IP 192.168.248.50.2152 > 192.168.248.169.2152: UDP, length 92
17:05:12.318777 IP 192.168.248.169.2152 > 192.168.248.50.2152: UDP, length 92
17:05:13.315901 IP 192.168.248.50.2152 > 192.168.248.169.2152: UDP, length 92
17:05:13.327729 IP 192.168.248.169.2152 > 192.168.248.50.2152: UDP, length 92
17:05:14.319284 IP 192.168.248.50.2152 > 192.168.248.169.2152: UDP, length 92
17:05:14.329010 IP 192.168.248.169.2152 > 192.168.248.50.2152: UDP, length 92
17:05:15.320726 IP 192.168.248.50.2152 > 192.168.248.169.2152: UDP, length 92
17:05:15.340337 IP 192.168.248.169.2152 > 192.168.248.50.2152: UDP, length 92
17:05:15.883999 IP 192.168.247.112.36412 > 192.168.247.50.36412: sctp (1) [HB REQ] 
17:05:16.317181 IP 192.168.248.50.2152 > 192.168.248.169.2152: UDP, length 92
17:05:16.351661 IP 192.168.248.169.2152 > 192.168.248.50.2152: UDP, length 92
17:05:17.317739 IP 192.168.248.50.2152 > 192.168.248.169.2152: UDP, length 92
17:05:17.330033 IP 192.168.248.169.2152 > 192.168.248.50.2152: UDP, length 92
17:05:18.314712 IP 192.168.248.50.2152 > 192.168.248.169.2152: UDP, length 92
17:05:18.325460 IP 192.168.248.169.2152 > 192.168.248.50.2152: UDP, length 92
17:05:19.317978 IP 192.168.248.50.2152 > 192.168.248.169.2152: UDP, length 92
17:05:19.335282 IP 192.168.248.169.2152 > 192.168.248.50.2152: UDP, length 92
17:05:20.326692 IP 192.168.248.50.2152 > 192.168.248.169.2152: UDP, length 92
17:05:20.337047 IP 192.168.248.169.2152 > 192.168.248.50.2152: UDP, length 92
17:05:21.260361 ARP, Reply 192.168.247.112 is-at fa:16:3e:a5:1d:5e (oui Unknown), length 46
17:05:21.329678 IP 192.168.248.50.2152 > 192.168.248.169.2152: UDP, length 92
17:05:21.345676 IP 192.168.248.169.2152 > 192.168.248.50.2152: UDP, length 92
17:05:22.336009 IP 192.168.248.50.2152 > 192.168.248.169.2152: UDP, length 92
17:05:22.345658 IP 192.168.248.169.2152 > 192.168.248.50.2152: UDP, length 92
17:05:22.793892 IP 192.168.247.112.36412 > 192.168.247.50.36412: sctp (1) [HB ACK] 
17:05:23.339560 IP 192.168.248.50.2152 > 192.168.248.169.2152: UDP, length 92
17:05:23.347890 IP 192.168.248.169.2152 > 192.168.248.50.2152: UDP, length 92
17:05:24.335844 IP 192.168.248.50.2152 > 192.168.248.169.2152: UDP, length 92
17:05:24.348468 IP 192.168.248.169.2152 > 192.168.248.50.2152: UDP, length 92
17:05:25.346060 IP 192.168.248.50.2152 > 192.168.248.169.2152: UDP, length 92
17:05:25.359080 IP 192.168.248.169.2152 > 192.168.248.50.2152: UDP, length 92
17:05:26.338988 IP 192.168.248.50.2152 > 192.168.248.169.2152: UDP, length 92
17:05:26.348140 IP 192.168.248.169.2152 > 192.168.248.50.2152: UDP, length 92
17:05:27.468105 IP 192.168.248.50.2152 > 192.168.248.169.2152: UDP, length 92
17:05:27.477239 IP 192.168.248.169.2152 > 192.168.248.50.2152: UDP, length 92
17:05:28.345924 IP 192.168.248.50.2152 > 192.168.248.169.2152: UDP, length 92
17:05:28.357011 IP 192.168.248.169.2152 > 192.168.248.50.2152: UDP, length 92
17:05:29.346500 IP 192.168.248.50.2152 > 192.168.248.169.2152: UDP, length 92
17:05:29.363790 IP 192.168.248.169.2152 > 192.168.248.50.2152: UDP, length 92
17:05:30.338346 IP 192.168.248.50.2152 > 192.168.248.169.2152: UDP, length 92
17:05:30.347798 IP 192.168.248.169.2152 > 192.168.248.50.2152: UDP, length 92
17:05:31.355941 IP 192.168.248.50.2152 > 192.168.248.169.2152: UDP, length 92
17:05:31.365028 IP 192.168.248.169.2152 > 192.168.248.50.2152: UDP, length 92
17:05:32.356613 IP 192.168.248.50.2152 > 192.168.248.169.2152: UDP, length 92
17:05:32.374674 IP 192.168.248.169.2152 > 192.168.248.50.2152: UDP, length 92
17:05:33.344974 IP 192.168.248.50.2152 > 192.168.248.169.2152: UDP, length 92
17:05:33.356011 IP 192.168.248.169.2152 > 192.168.248.50.2152: UDP, length 92
17:05:34.348820 IP 192.168.248.50.2152 > 192.168.248.169.2152: UDP, length 92
17:05:34.358706 IP 192.168.248.169.2152 > 192.168.248.50.2152: UDP, length 92
17:05:34.543479 ARP, Request who-has 192.168.248.50 tell 192.168.248.169, length 46
17:05:34.545576 ARP, Reply 192.168.248.50 is-at 00:80:8e:8d:90:ab (oui Unknown), length 46
17:05:35.358320 IP 192.168.248.50.2152 > 192.168.248.169.2152: UDP, length 92
17:05:35.373449 IP 192.168.248.169.2152 > 192.168.248.50.2152: UDP, length 92
17:05:36.358023 IP 192.168.248.50.2152 > 192.168.248.169.2152: UDP, length 92
17:05:36.368515 IP 192.168.248.169.2152 > 192.168.248.50.2152: UDP, length 92
17:05:37.365761 IP 192.168.248.50.2152 > 192.168.248.169.2152: UDP, length 92
17:05:37.379038 IP 192.168.248.169.2152 > 192.168.248.50.2152: UDP, length 92
17:05:37.642702 ARP, Request who-has 192.168.248.169 tell 192.168.248.50, length 46
17:05:37.643252 ARP, Reply 192.168.248.169 is-at fa:16:3e:30:1e:d4 (oui Unknown), length 46
17:05:38.358422 IP 192.168.248.50.2152 > 192.168.248.169.2152: UDP, length 92
17:05:38.370187 IP 192.168.248.169.2152 > 192.168.248.50.2152: UDP, length 92
17:05:39.365867 IP 192.168.248.50.2152 > 192.168.248.169.2152: UDP, length 92
17:05:39.383125 IP 192.168.248.169.2152 > 192.168.248.50.2152: UDP, length 92
17:05:40.370019 IP 192.168.248.50.2152 > 192.168.248.169.2152: UDP, length 92
17:05:40.380655 IP 192.168.248.169.2152 > 192.168.248.50.2152: UDP, length 92
17:05:41.377363 IP 192.168.248.50.2152 > 192.168.248.169.2152: UDP, length 92
17:05:41.388989 IP 192.168.248.169.2152 > 192.168.248.50.2152: UDP, length 92
17:05:42.376651 IP 192.168.248.50.2152 > 192.168.248.169.2152: UDP, length 92
17:05:42.391604 IP 192.168.248.169.2152 > 192.168.248.50.2152: UDP, length 92
17:05:43.386333 IP 192.168.248.50.2152 > 192.168.248.169.2152: UDP, length 92
17:05:43.397763 IP 192.168.248.169.2152 > 192.168.248.50.2152: UDP, length 92
17:05:44.376101 IP 192.168.248.50.2152 > 192.168.248.169.2152: UDP, length 92
17:05:44.389812 IP 192.168.248.169.2152 > 192.168.248.50.2152: UDP, length 92
17:05:45.386265 IP 192.168.248.50.2152 > 192.168.248.169.2152: UDP, length 92
17:05:45.398242 IP 192.168.248.169.2152 > 192.168.248.50.2152: UDP, length 92
17:05:46.385658 IP 192.168.248.50.2152 > 192.168.248.169.2152: UDP, length 92
17:05:46.400616 IP 192.168.248.169.2152 > 192.168.248.50.2152: UDP, length 92
17:05:47.386007 IP 192.168.248.50.2152 > 192.168.248.169.2152: UDP, length 92
17:05:47.393281 IP 192.168.248.169.2152 > 192.168.248.50.2152: UDP, length 92
17:05:48.398781 IP 192.168.248.50.2152 > 192.168.248.169.2152: UDP, length 92
17:05:48.408578 IP 192.168.248.169.2152 > 192.168.248.50.2152: UDP, length 92
17:05:48.647109 IP 192.168.247.112.36412 > 192.168.247.50.36412: sctp (1) [HB REQ] 
17:05:49.410889 IP 192.168.248.50.2152 > 192.168.248.169.2152: UDP, length 92
17:05:49.411793 IP 192.168.248.169.2152 > 192.168.248.50.2152: UDP, length 92
17:05:50.388265 IP 192.168.248.50.2152 > 192.168.248.169.2152: UDP, length 92
17:05:50.397720 IP 192.168.248.169.2152 > 192.168.248.50.2152: UDP, length 92
17:05:51.391967 IP 192.168.248.50.2152 > 192.168.248.169.2152: UDP, length 92
17:05:51.412274 IP 192.168.248.169.2152 > 192.168.248.50.2152: UDP, length 92
17:05:52.398763 IP 192.168.248.50.2152 > 192.168.248.169.2152: UDP, length 92
17:05:52.410259 IP 192.168.248.169.2152 > 192.168.248.50.2152: UDP, length 92
17:05:53.397025 IP 192.168.248.50.2152 > 192.168.248.169.2152: UDP, length 92
17:05:53.408615 IP 192.168.248.169.2152 > 192.168.248.50.2152: UDP, length 92
17:05:54.027026 ARP, Reply 192.168.247.112 is-at fa:16:3e:a5:1d:5e (oui Unknown), length 46
17:05:54.398517 IP 192.168.248.50.2152 > 192.168.248.169.2152: UDP, length 92
17:05:54.408653 IP 192.168.248.169.2152 > 192.168.248.50.2152: UDP, length 92
17:05:54.538529 IP 192.168.247.112.36412 > 192.168.247.50.36412: sctp (1) [HB ACK] 
17:05:55.405744 IP 192.168.248.50.2152 > 192.168.248.169.2152: UDP, length 92
17:05:55.418771 IP 192.168.248.169.2152 > 192.168.248.50.2152: UDP, length 92
17:05:56.415909 IP 192.168.248.50.2152 > 192.168.248.169.2152: UDP, length 92
17:05:56.427712 IP 192.168.248.169.2152 > 192.168.248.50.2152: UDP, length 92
17:05:57.415659 IP 192.168.248.50.2152 > 192.168.248.169.2152: UDP, length 92
17:05:57.425184 IP 192.168.248.169.2152 > 192.168.248.50.2152: UDP, length 92
17:05:58.415727 IP 192.168.248.50.2152 > 192.168.248.169.2152: UDP, length 92
17:05:58.424927 IP 192.168.248.169.2152 > 192.168.248.50.2152: UDP, length 92
17:05:59.416675 IP 192.168.248.50.2152 > 192.168.248.169.2152: UDP, length 92
17:05:59.425735 IP 192.168.248.169.2152 > 192.168.248.50.2152: UDP, length 92
17:05:59.651915 ARP, Request who-has 192.168.247.50 tell 192.168.247.112, length 46
17:06:00.425673 IP 192.168.248.50.2152 > 192.168.248.169.2152: UDP, length 92
17:06:00.435081 IP 192.168.248.169.2152 > 192.168.248.50.2152: UDP, length 92
17:06:01.425724 IP 192.168.248.50.2152 > 192.168.248.169.2152: UDP, length 92
17:06:01.435007 IP 192.168.248.169.2152 > 192.168.248.50.2152: UDP, length 92
17:06:02.427001 IP 192.168.248.50.2152 > 192.168.248.169.2152: UDP, length 92
17:06:02.439489 IP 192.168.248.169.2152 > 192.168.248.50.2152: UDP, length 92
17:06:03.426434 IP 192.168.248.50.2152 > 192.168.248.169.2152: UDP, length 92
17:06:03.453904 IP 192.168.248.169.2152 > 192.168.248.50.2152: UDP, length 92
17:06:03.470838 ARP, Request who-has 192.168.248.50 tell 192.168.248.169, length 46
17:06:03.477039 ARP, Reply 192.168.248.50 is-at 00:80:8e:8d:90:ab (oui Unknown), length 46
17:06:04.423960 IP 192.168.248.50.2152 > 192.168.248.169.2152: UDP, length 92
17:06:04.440017 IP 192.168.248.169.2152 > 192.168.248.50.2152: UDP, length 92
17:06:05.435589 IP 192.168.248.50.2152 > 192.168.248.169.2152: UDP, length 92
17:06:05.463047 IP 192.168.248.169.2152 > 192.168.248.50.2152: UDP, length 92
17:06:06.723377 IP 192.168.248.50.2152 > 192.168.248.169.2152: UDP, length 92
17:06:06.728521 IP 192.168.248.169.2152 > 192.168.248.50.2152: UDP, length 92
17:06:07.428780 IP 192.168.248.50.2152 > 192.168.248.169.2152: UDP, length 92
17:06:07.448194 IP 192.168.248.169.2152 > 192.168.248.50.2152: UDP, length 92
17:06:08.431380 IP 192.168.248.50.2152 > 192.168.248.169.2152: UDP, length 92
17:06:08.467834 IP 192.168.248.169.2152 > 192.168.248.50.2152: UDP, length 92
17:06:09.434344 IP 192.168.248.50.2152 > 192.168.248.169.2152: UDP, length 92
17:06:09.444943 IP 192.168.248.169.2152 > 192.168.248.50.2152: UDP, length 92
17:06:09.894534 ARP, Request who-has 192.168.248.169 tell 192.168.248.50, length 46
17:06:09.897359 ARP, Reply 192.168.248.169 is-at fa:16:3e:30:1e:d4 (oui Unknown), length 46
17:06:10.440872 IP 192.168.248.50.2152 > 192.168.248.169.2152: UDP, length 92
17:06:10.450479 IP 192.168.248.169.2152 > 192.168.248.50.2152: UDP, length 92
17:06:11.437632 IP 192.168.248.50.2152 > 192.168.248.169.2152: UDP, length 92
17:06:11.447899 IP 192.168.248.169.2152 > 192.168.248.50.2152: UDP, length 92
17:06:12.442752 IP 192.168.248.50.2152 > 192.168.248.169.2152: UDP, length 92
17:06:12.452388 IP 192.168.248.169.2152 > 192.168.248.50.2152: UDP, length 92
17:06:13.446155 IP 192.168.248.50.2152 > 192.168.248.169.2152: UDP, length 92
17:06:13.469909 IP 192.168.248.169.2152 > 192.168.248.50.2152: UDP, length 92
17:06:14.450726 IP 192.168.248.50.2152 > 192.168.248.169.2152: UDP, length 92
17:06:14.456732 IP 192.168.248.169.2152 > 192.168.248.50.2152: UDP, length 92
17:06:15.456369 IP 192.168.248.50.2152 > 192.168.248.169.2152: UDP, length 92
17:06:15.464372 IP 192.168.248.169.2152 > 192.168.248.50.2152: UDP, length 92
17:06:16.447732 IP 192.168.248.50.2152 > 192.168.248.169.2152: UDP, length 92
17:06:16.455853 IP 192.168.248.169.2152 > 192.168.248.50.2152: UDP, length 92
17:06:17.448001 IP 192.168.248.50.2152 > 192.168.248.169.2152: UDP, length 92
17:06:17.458281 IP 192.168.248.169.2152 > 192.168.248.50.2152: UDP, length 92
17:06:18.456210 IP 192.168.248.50.2152 > 192.168.248.169.2152: UDP, length 92
17:06:18.464390 IP 192.168.248.169.2152 > 192.168.248.50.2152: UDP, length 92
17:06:19.455851 IP 192.168.248.50.2152 > 192.168.248.169.2152: UDP, length 92
17:06:19.465317 IP 192.168.248.169.2152 > 192.168.248.50.2152: UDP, length 92
17:06:20.447856 IP 192.168.248.50.2152 > 192.168.248.169.2152: UDP, length 92
17:06:20.457155 IP 192.168.248.169.2152 > 192.168.248.50.2152: UDP, length 92
17:06:21.413737 IP 192.168.247.112.36412 > 192.168.247.50.36412: sctp (1) [HB REQ] 
17:06:21.456506 IP 192.168.248.50.2152 > 192.168.248.169.2152: UDP, length 92
17:06:21.465165 IP 192.168.248.169.2152 > 192.168.248.50.2152: UDP, length 92
17:06:22.447309 IP 192.168.248.50.2152 > 192.168.248.169.2152: UDP, length 92
17:06:22.456031 IP 192.168.248.169.2152 > 192.168.248.50.2152: UDP, length 92
17:06:23.455986 IP 192.168.248.50.2152 > 192.168.248.169.2152: UDP, length 92
17:06:23.465485 IP 192.168.248.169.2152 > 192.168.248.50.2152: UDP, length 92
17:06:24.465805 IP 192.168.248.50.2152 > 192.168.248.169.2152: UDP, length 92
17:06:24.514502 IP 192.168.248.169.2152 > 192.168.248.50.2152: UDP, length 92
17:06:25.257663 IP 192.168.247.112.36412 > 192.168.247.50.36412: sctp (1) [HB ACK] 
17:06:25.455987 IP 192.168.248.50.2152 > 192.168.248.169.2152: UDP, length 92
17:06:25.467859 IP 192.168.248.169.2152 > 192.168.248.50.2152: UDP, length 92
17:06:26.455630 IP 192.168.248.50.2152 > 192.168.248.169.2152: UDP, length 92
17:06:26.477416 IP 192.168.248.169.2152 > 192.168.248.50.2152: UDP, length 92
17:06:26.792902 ARP, Reply 192.168.247.112 is-at fa:16:3e:a5:1d:5e (oui Unknown), length 46
17:06:27.465607 IP 192.168.248.50.2152 > 192.168.248.169.2152: UDP, length 92
17:06:27.473872 IP 192.168.248.169.2152 > 192.168.248.50.2152: UDP, length 92
17:06:28.451707 IP 192.168.248.50.2152 > 192.168.248.169.2152: UDP, length 92
17:06:28.462303 IP 192.168.248.169.2152 > 192.168.248.50.2152: UDP, length 92
17:06:29.465616 IP 192.168.248.50.2152 > 192.168.248.169.2152: UDP, length 92
17:06:29.473525 IP 192.168.248.169.2152 > 192.168.248.50.2152: UDP, length 92
17:06:30.457334 IP 192.168.248.50.2152 > 192.168.248.169.2152: UDP, length 92
17:06:30.465635 IP 192.168.248.169.2152 > 192.168.248.50.2152: UDP, length 92
17:06:31.467636 IP 192.168.248.50.2152 > 192.168.248.169.2152: UDP, length 92
17:06:31.478005 IP 192.168.248.169.2152 > 192.168.248.50.2152: UDP, length 92
17:06:32.458178 IP 192.168.248.50.2152 > 192.168.248.169.2152: UDP, length 92
17:06:32.467986 IP 192.168.248.169.2152 > 192.168.248.50.2152: UDP, length 92
17:06:32.655550 ARP, Request who-has 192.168.248.50 tell 192.168.248.169, length 46
17:06:32.659408 ARP, Reply 192.168.248.50 is-at 00:80:8e:8d:90:ab (oui Unknown), length 46
17:06:33.456503 IP 192.168.248.50.2152 > 192.168.248.169.2152: UDP, length 92
17:06:33.467684 IP 192.168.248.169.2152 > 192.168.248.50.2152: UDP, length 92
17:06:34.465841 IP 192.168.248.50.2152 > 192.168.248.169.2152: UDP, length 92
17:06:34.486141 IP 192.168.248.169.2152 > 192.168.248.50.2152: UDP, length 92
17:06:35.475853 IP 192.168.248.50.2152 > 192.168.248.169.2152: UDP, length 92
17:06:35.485606 IP 192.168.248.169.2152 > 192.168.248.50.2152: UDP, length 92
17:06:36.685965 IP 192.168.248.50.2152 > 192.168.248.169.2152: UDP, length 92
17:06:36.695839 IP 192.168.248.169.2152 > 192.168.248.50.2152: UDP, length 92
17:06:37.467789 IP 192.168.248.50.2152 > 192.168.248.169.2152: UDP, length 92
17:06:37.475629 IP 192.168.248.169.2152 > 192.168.248.50.2152: UDP, length 92
17:06:38.475754 IP 192.168.248.50.2152 > 192.168.248.169.2152: UDP, length 92
17:06:38.485261 IP 192.168.248.169.2152 > 192.168.248.50.2152: UDP, length 92
17:06:39.475800 IP 192.168.248.50.2152 > 192.168.248.169.2152: UDP, length 92
17:06:39.484816 IP 192.168.248.169.2152 > 192.168.248.50.2152: UDP, length 92
17:06:40.467456 IP 192.168.248.50.2152 > 192.168.248.169.2152: UDP, length 92
17:06:40.475436 IP 192.168.248.169.2152 > 192.168.248.50.2152: UDP, length 92
17:06:41.472837 IP 192.168.248.50.2152 > 192.168.248.169.2152: UDP, length 92
17:06:41.481769 IP 192.168.248.169.2152 > 192.168.248.50.2152: UDP, length 92
17:06:42.152652 ARP, Request who-has 192.168.248.169 tell 192.168.248.50, length 46
17:06:42.156192 ARP, Reply 192.168.248.169 is-at fa:16:3e:30:1e:d4 (oui Unknown), length 46
17:06:42.469716 IP 192.168.248.50.2152 > 192.168.248.169.2152: UDP, length 92
17:06:42.479867 IP 192.168.248.169.2152 > 192.168.248.50.2152: UDP, length 92
17:06:43.475904 IP 192.168.248.50.2152 > 192.168.248.169.2152: UDP, length 92
17:06:43.493487 IP 192.168.248.169.2152 > 192.168.248.50.2152: UDP, length 92
17:06:44.470943 IP 192.168.248.50.2152 > 192.168.248.169.2152: UDP, length 92
17:06:44.477906 IP 192.168.248.169.2152 > 192.168.248.50.2152: UDP, length 92
17:06:45.468243 IP 192.168.248.50.2152 > 192.168.248.169.2152: UDP, length 92
17:06:45.478514 IP 192.168.248.169.2152 > 192.168.248.50.2152: UDP, length 92
17:06:46.468373 IP 192.168.248.50.2152 > 192.168.248.169.2152: UDP, length 92
17:06:46.478804 IP 192.168.248.169.2152 > 192.168.248.50.2152: UDP, length 92
17:06:47.485644 IP 192.168.248.50.2152 > 192.168.248.169.2152: UDP, length 92
17:06:47.496302 IP 192.168.248.169.2152 > 192.168.248.50.2152: UDP, length 92
17:06:48.478350 IP 192.168.248.50.2152 > 192.168.248.169.2152: UDP, length 92
17:06:48.488064 IP 192.168.248.169.2152 > 192.168.248.50.2152: UDP, length 92
17:06:49.493241 IP 192.168.248.50.2152 > 192.168.248.169.2152: UDP, length 92
17:06:49.508372 IP 192.168.248.169.2152 > 192.168.248.50.2152: UDP, length 92
18:11:58.604265 IP6 fe80::acd2:18ff:fe1c:39d1 > ip6-allrouters: ICMP6, router solicitation, length 16
18:38:46.559757 IP6 fe80::fc16:3eff:fe6d:1347 > ip6-allrouters: ICMP6, router solicitation, length 16
18:49:45.011287 IP fornebu.uninett.simula.nornet > gul.uninett.simula.nornet: ICMP echo request, id 65144, seq 0, length 28
19:10:57.544562 IP6 fe80::acd2:18ff:fe1c:39d1 > ip6-allrouters: ICMP6, router solicitation, length 16
19:44:18.716289 IP6 fe80::fc16:3eff:fe6d:1347 > ip6-allrouters: ICMP6, router solicitation, length 16
20:12:07.567531 IP6 fe80::acd2:18ff:fe1c:39d1 > ip6-allrouters: ICMP6, router solicitation, length 16
20:41:06.590464 IP6 fe80::fc16:3eff:fe6d:1347 > ip6-allrouters: ICMP6, router solicitation, length 16
21:15:28.642857 IP6 fe80::acd2:18ff:fe1c:39d1 > ip6-allrouters: ICMP6, router solicitation, length 16
21:44:27.675136 IP6 fe80::fc16:3eff:fe6d:1347 > ip6-allrouters: ICMP6, router solicitation, length 16
22:16:38.668769 IP6 fe80::acd2:18ff:fe1c:39d1 > ip6-allrouters: ICMP6, router solicitation, length 16
22:41:15.548394 IP6 fe80::fc16:3eff:fe6d:1347 > ip6-allrouters: ICMP6, router solicitation, length 16
23:17:48.690343 IP6 fe80::acd2:18ff:fe1c:39d1 > ip6-allrouters: ICMP6, router solicitation, length 16
23:42:25.565584 IP6 fe80::fc16:3eff:fe6d:1347 > ip6-allrouters: ICMP6, router solicitation, length 16
00:18:58.704752 IP6 fe80::acd2:18ff:fe1c:39d1 > ip6-allrouters: ICMP6, router solicitation, length 16
00:45:46.653745 IP6 fe80::fc16:3eff:fe6d:1347 > ip6-allrouters: ICMP6, router solicitation, length 16
01:22:19.786381 IP6 fe80::acd2:18ff:fe1c:39d1 > ip6-allrouters: ICMP6, router solicitation, length 16
01:44:45.597090 IP6 fe80::fc16:3eff:fe6d:1347 > ip6-allrouters: ICMP6, router solicitation, length 16
02:27:51.946745 IP6 fe80::acd2:18ff:fe1c:39d1 > ip6-allrouters: ICMP6, router solicitation, length 16
02:39:22.397568 IP6 fe80::fc16:3eff:fe6d:1347 > ip6-allrouters: ICMP6, router solicitation, length 16
03:35:35.180699 IP6 fe80::acd2:18ff:fe1c:39d1 > ip6-allrouters: ICMP6, router solicitation, length 16
03:36:10.268601 IP6 fe80::fc16:3eff:fe6d:1347 > ip6-allrouters: ICMP6, router solicitation, length 16
04:30:11.981605 IP6 fe80::acd2:18ff:fe1c:39d1 > ip6-allrouters: ICMP6, router solicitation, length 16
04:30:47.072710 IP6 fe80::fc16:3eff:fe6d:1347 > ip6-allrouters: ICMP6, router solicitation, length 16
05:31:22.001792 IP6 fe80::acd2:18ff:fe1c:39d1 > ip6-allrouters: ICMP6, router solicitation, length 16
05:31:57.089771 IP6 fe80::fc16:3eff:fe6d:1347 > ip6-allrouters: ICMP6, router solicitation, length 16
06:26:33.886071 IP6 fe80::fc16:3eff:fe6d:1347 > ip6-allrouters: ICMP6, router solicitation, length 16
06:34:43.085633 IP6 fe80::acd2:18ff:fe1c:39d1 > ip6-allrouters: ICMP6, router solicitation, length 16
07:25:32.827718 IP6 fe80::fc16:3eff:fe6d:1347 > ip6-allrouters: ICMP6, router solicitation, length 16
07:38:04.170114 IP6 fe80::acd2:18ff:fe1c:39d1 > ip6-allrouters: ICMP6, router solicitation, length 16
08:28:53.919250 IP6 fe80::fc16:3eff:fe6d:1347 > ip6-allrouters: ICMP6, router solicitation, length 16
08:41:25.262024 IP6 fe80::acd2:18ff:fe1c:39d1 > ip6-allrouters: ICMP6, router solicitation, length 16
09:34:26.075625 IP6 fe80::fc16:3eff:fe6d:1347 > ip6-allrouters: ICMP6, router solicitation, length 16
09:44:46.345667 IP6 fe80::acd2:18ff:fe1c:39d1 > ip6-allrouters: ICMP6, router solicitation, length 16
10:33:25.020879 IP6 fe80::fc16:3eff:fe6d:1347 > ip6-allrouters: ICMP6, router solicitation, length 16
10:37:29.831570 IP 0.0.0.0.bootpc > 255.255.255.255.bootps: BOOTP/DHCP, Request from 00:80:8e:8d:90:ab (oui Unknown), length 288
10:37:30.827170 IP 10.255.1.1.bootps > gul.uninett.simula.nornet.bootpc: BOOTP/DHCP, Reply, length 300
10:37:30.827884 IP 0.0.0.0.bootpc > 255.255.255.255.bootps: BOOTP/DHCP, Request from 00:80:8e:8d:90:ab (oui Unknown), length 300
10:37:32.236951 IP 0.0.0.0.bootpc > 255.255.255.255.bootps: BOOTP/DHCP, Request from 00:80:8e:8d:90:ab (oui Unknown), length 300
10:37:33.678645 IP 10.255.1.1.bootps > gul.uninett.simula.nornet.bootpc: BOOTP/DHCP, Reply, length 300
10:37:33.679295 IP 10.255.1.1.bootps > gul.uninett.simula.nornet.bootpc: BOOTP/DHCP, Reply, length 300
10:37:33.864247 ARP, Request who-has fornebu.uninett.simula.nornet tell gul.uninett.simula.nornet, length 46
10:37:33.867772 ARP, Reply fornebu.uninett.simula.nornet is-at 52:54:00:2c:c5:f9 (oui Unknown), length 46
10:37:33.892110 IP fornebu.uninett.simula.nornet.domain > gul.uninett.simula.nornet.53731: 25812 2/0/1 A 162.213.33.132, A 162.213.33.108 (77)
10:37:33.892352 IP fornebu.uninett.simula.nornet.domain > gul.uninett.simula.nornet.58449: 61919 0/1/1 (106)
10:37:37.400699 IP fornebu.uninett.simula.nornet.domain > gul.uninett.simula.nornet.37841: 20302 0/1/1 (109)
10:37:37.433034 IP fornebu.uninett.simula.nornet.domain > gul.uninett.simula.nornet.50934: 5476 6/0/1 A 91.189.92.41, A 91.189.92.38, A 91.189.92.20, A 91.189.92.40, A 91.189.92.19, A 91.189.92.39 (141)
10:37:37.464110 IP api.snapcraft.io.https > gul.uninett.simula.nornet.36086: Flags [S.], seq 3348106244, ack 1519294474, win 28960, options [mss 1460,sackOK,TS val 430655991 ecr 4018898773,nop,wscale 7], length 0
10:37:37.539961 IP api.snapcraft.io.https > gul.uninett.simula.nornet.36086: Flags [P.], seq 3452:3503, ack 294, win 235, options [nop,nop,TS val 430656010 ecr 4018898850], length 51
10:37:37.571416 IP api.snapcraft.io.https > gul.uninett.simula.nornet.36086: Flags [P.], seq 3503:4637, ack 683, win 243, options [nop,nop,TS val 430656018 ecr 4018898880], length 1134
10:37:37.637662 IP api.snapcraft.io.https > gul.uninett.simula.nornet.42220: Flags [S.], seq 225832252, ack 3759283160, win 28960, options [mss 1460,sackOK,TS val 4208420903 ecr 1420800142,nop,wscale 7], length 0
10:37:37.672919 IP api.snapcraft.io.https > gul.uninett.simula.nornet.42220: Flags [P.], seq 2897:3452, ack 168, win 235, options [nop,nop,TS val 4208420912 ecr 1420800176], length 555
10:37:37.707585 IP api.snapcraft.io.https > gul.uninett.simula.nornet.42220: Flags [P.], seq 3452:3503, ack 294, win 235, options [nop,nop,TS val 4208420921 ecr 1420800212], length 51
10:37:37.741777 IP api.snapcraft.io.https > gul.uninett.simula.nornet.42220: Flags [P.], seq 3503:3773, ack 709, win 243, options [nop,nop,TS val 4208420929 ecr 1420800246], length 270
10:37:37.741994 IP api.snapcraft.io.https > gul.uninett.simula.nornet.42220: Flags [P.], seq 3773:3804, ack 709, win 243, options [nop,nop,TS val 4208420929 ecr 1420800246], length 31
10:37:37.745155 IP api.snapcraft.io.https > gul.uninett.simula.nornet.42220: Flags [F.], seq 3804, ack 709, win 243, options [nop,nop,TS val 4208420929 ecr 1420800246], length 0
10:37:37.777113 IP api.snapcraft.io.https > gul.uninett.simula.nornet.42220: Flags [R], seq 225836057, win 0, length 0
10:37:37.777410 IP api.snapcraft.io.https > gul.uninett.simula.nornet.42220: Flags [R], seq 225836057, win 0, length 0
10:37:39.057759 ARP, Request who-has gul.uninett.simula.nornet tell fornebu.uninett.simula.nornet, length 46
10:37:39.741381 IP api.snapcraft.io.https > gul.uninett.simula.nornet.36086: Flags [P.], seq 4637:4668, ack 684, win 243, options [nop,nop,TS val 430656561 ecr 4018901051], length 31
10:37:39.741505 IP api.snapcraft.io.https > gul.uninett.simula.nornet.36086: Flags [F.], seq 4668, ack 684, win 243, options [nop,nop,TS val 430656561 ecr 4018901051], length 0
10:38:03.787999 IP fornebu.uninett.simula.nornet.domain > gul.uninett.simula.nornet.54053: 30979 4/0/1 A 91.189.89.198, A 91.189.91.157, A 91.189.89.199, A 91.189.94.4 (107)
10:38:03.788545 IP fornebu.uninett.simula.nornet.domain > gul.uninett.simula.nornet.47888: 58235 2/0/1 AAAA 2001:67c:1560:8003::c7, AAAA 2001:67c:1560:8003::c8 (99)
10:38:03.819007 IP chilipepper.canonical.com.ntp > gul.uninett.simula.nornet.50997: NTPv4, Server, length 48
10:38:08.809240 ARP, Reply fornebu.uninett.simula.nornet is-at 52:54:00:2c:c5:f9 (oui Unknown), length 46
10:38:09.010287 ARP, Request who-has gul.uninett.simula.nornet tell fornebu.uninett.simula.nornet, length 46
10:38:11.494348 IP gul.uninett.simula.nornet.1716 > 255.255.255.255.1716: UDP, length 1012
10:38:11.494821 IP gul.uninett.simula.nornet.1716 > 255.255.255.255.1716: UDP, length 1012
